{
  "schema_version": "1.0",
  "id": "T01",
  "title": "修复 Claude result 终局的一次性 stdin 关闭",
  "batch_id": "B01",
  "phase": "parallel",
  "kind": "implementation",
  "priority": "P0",
  "status": "planned",
  "objective": "修复 Claude result 终局的一次性 stdin 关闭。完成本任务范围并交付可核验结果，不代替其他任务或提前宣称整个 W 项完成。",
  "work_items": [
    "W01"
  ],
  "requirements_owned": [
    "W01-R01",
    "W01-R02",
    "W01-R03",
    "W01-R04"
  ],
  "requirements_verified": [],
  "depends_on": [
    "G00"
  ],
  "base": {
    "mode": "previous_batch_integrated_head",
    "predecessor_gate": "G00",
    "required_ancestor": "919f140f64f89c80933802840c8878681a85a4d9",
    "verification_head_gate": null,
    "bootstrap_required": true
  },
  "context": {
    "repository": "agent-adaptor",
    "source_repository_hint": "/Users/blurooo/project/agent-adaptor-internal",
    "source_head": "e2f0620bdd6477e6fe16f6db5648093589342ca2",
    "source_commits": [
      "eefcaef35621e6bbfb3e2e859edf4aadc4e38a5d",
      "a88eacdb4818c75df44caeec39bbb74062e58c53",
      "d01a086e5145566b7313b83ca88bb525f1d3675b"
    ],
    "source_read_rule": "用 git -C <实际internal仓库> show <固定sha>:<文件>；hint可由派发器映射到只读clone，不能依赖worktree的../相对位置或读取internal脏工作区。",
    "authority": {
      "path": "AGENTS.md",
      "baseline_sha256": "82ab6e82530363daeb3a303708bebe913b7e1f661ccdd39812715925355338df"
    },
    "plan": {
      "path": "docs/internal-history-alignment-plan-2026-09-07.md",
      "sha256": "73f4b596937160462cfef370f7600aa7a2a2b1b78d9d2861f4d7f2202bf4a6f8",
      "sections": [
        "W01"
      ]
    },
    "required_reads": [
      "AGENTS.md",
      "docs/internal-history-alignment-plan-2026-09-07.md",
      "docs/alignment-tasks/2026-09-07/README.md"
    ],
    "dependency_artifacts": [
      {
        "producer": "G00",
        "path": "docs/alignment-tasks/2026-09-07/contracts/frozen.json",
        "version_source": "G00 accepted contract manifest"
      }
    ],
    "embedded_plan_sections": {
      "W01": "### W01：Claude 收到 type:result 后结束一次性 stdin\n\n**证据与差距。** internal `eefcaef` 为 `handleResult` 增加关闭 stdin，`a88eacd` 去掉提取后重复的 guard，`d01a086` 合入。当前 `claude/parser.go` 的 `handleResult` 没有该动作；`onAssistantMessageStop` 仅在非空且非 `tool_use` 的 stop reason 后关闭。只收到终局 `result`、没有此前 `message_stop(end_turn)` 时，双向 print 进程可能继续等待 stdin。\n\n**实施。** 提取 parser 私有的终局 stdin 关闭函数，让 `message_stop` 与正式 `type:result` 共用；关闭 exactly-once。一次性 `WithSpawn` 和无状态 interactive 路径真正关闭输入；常驻 turn 的 stdin 适配器仍保持“不关闭底层进程输入”的合同。不可把 `tool_use`、中间消息或嵌套工具终局当作整个 run 终局。\n\n**验收。** 只发 result 的成功/失败/native schema fixture 都有界退出；`message_stop + result` 只关闭一次；`tool_use` 后仍能接收应答；常驻第二轮可执行；末尾 stdout、Terminal、Transcript、RunFinished 均保留。取消与终局并发不阻塞。更新 `claude/README-streaming.md`、`docs/streaming.md`、CHANGELOG。"
    }
  },
  "ownership": {
    "allow": [
      "claude/**",
      "docs/alignment-tasks/2026-09-07/handoffs/T01/**"
    ],
    "scope_match": "仅精确仓库相对文件或目录/**；任何未列路径不可写。",
    "exclusive_resources": [],
    "shared_files_policy": "集中docs/CHANGELOG仅本批gate写；仅own allow含golden/mod的任务可改它们；不得越界修复。",
    "scope_expansion": "先提交具体路径与原因给批次协调者；协调者更新版本/冲突检查并重排后重派，未授权范围不得修改。"
  },
  "execution": {
    "environment": "local",
    "isolation": "separate_git_worktree",
    "branch": "codex/alignment-t01",
    "same_batch_peer_artifacts": "禁止读取/依赖同批worker尚未验收的代码或输出；只消费前批已合入合同，公共Go符号不得由同批peer供应。",
    "source_write_allowed": true,
    "paid_live_authorization_required": false,
    "live_build_tag": null,
    "remote_push_allowed": false,
    "release_tag_allowed": false,
    "further_delegation": "不自动派发额外用户任务；若需要子任务由协调者纳入相同边界和覆盖检查。"
  },
  "invariants": [
    "以 AGENTS.md 和固定对齐方案为准；源仓库只用 git show 固定提交读取，不修改 internal、不复制其旧架构或未提交 vision 内容。",
    "保留六名词模型、唯一 New、Run/Stream、统一 resolved invocation/Thread 管线和 typed Event；不引入 SDK/Admin/Start/RunHandle/registry/default binding、平行语义 channel 或 root WithTeam。",
    "Options 作用域编译约束不变；近处替换、skills 追加、Policy 整值替换；WithTimeout 仍墙钟，Thread 默认常驻，WithSpawn 本轮新进程。",
    "完整 fingerprint、opaque Thread key、lease owner/token、单 writer、原子 Finalize 与失败不污染 checkpoint 均保留；交付后绝不自动重放。",
    "仅 Driver 解释正式 provider 协议；shared helper 不猜 session/tool/todo/capability；nil/不支持能力明确失败，Inspect 使用构造配置。",
    "一个 error 判定面；部分输出不得丢，Text/Summary/Raw/Transcript/Services/Usage/Decode 独立；Run 与 Stream.Result 等价。",
    "保留 v1.1.1 Tool 凭据/权限/隔离、v1.1.2 Windows 常驻和已有安全更新；不得因源码旧而覆盖掉当前更强合同。",
    "公共语义变更同时交付合同测试、局部 godoc 和 documentation.md 文档片段；集中使用文档/CHANGELOG 由本批 gate 在放行前合并，不能留到最终批才记录。",
    "只有拥有对应文件的任务可改 root/Driver AST golden；先审阅新增声明再精确更新，禁止全局设置 golden 更新环境掩盖漂移。",
    "只写 ownership.allow 指定路径，不顺手重构其他子系统；需要扩大范围时向批次协调者提交具体变更理由和路径，先消除同批冲突再重派本任务。",
    "不写 TODO、空实现、未来才有的兼容 shim；先用失败可复现的 fixture 验证问题，再实现并验证；不得只满足实现本身的镜像测试。",
    "普通验证显式关闭付费门，不访问真实 provider；live 任务须同时满足授权记录、build tag 和环境变量门。所有任务都不创建 tag、不发布 release、不自动推送/发送外部消息。"
  ],
  "implementation_steps": [
    "构建只有 type:result、无 message_stop 的成功/失败/native schema fixture，使修复前的等待可被有界测试发现。",
    "由 handleResult 与 onAssistantMessageStop 共用 exactly-once close helper，保持 tool_use/中间帧输入开放。",
    "核实常驻 stdin 适配器 Close 不关闭进程底层输入；保留第二轮、末尾 Raw/terminal/transcript 和取消行为。"
  ],
  "acceptance_criteria": [
    {
      "id": "T01-AC01",
      "requirement": "一次性成功/失败/schema result 都有界退出，重复终局只关闭一次。",
      "required": true
    },
    {
      "id": "T01-AC02",
      "requirement": "tool_use 可回答，常驻第二轮可跑，Cancel 与终局竞态无死锁/事件尾丢失。",
      "required": true
    }
  ],
  "validation": [
    {
      "id": "T01-V01",
      "command": "go test -count=1 ./claude",
      "cwd": "repository_root",
      "environment": {
        "AGENT_ADAPTOR_LIVE_CONFORMANCE": "0",
        "AGENT_ADAPTOR_E2E": "0",
        "AGENT_ADAPTOR_UPDATE_API_GOLDEN": "0"
      },
      "required": true,
      "execution_condition": "assigned_environment_available",
      "must_execute_nonzero_tests": true,
      "evidence": "记录实际命令、head SHA、OS/Go/CLI版本、exit code和安全日志；失败/skip/零测试不算通过。 非零按本命令实际测试/子测试计数，fuzz按实际种子/执行样本计数；必需场景skip不得通过。普通任务显式禁用的live探针或合同确认不适用的probe可skip，须列明且不能拿它们充当验收证据；可添加-json/-v采集日志，不能缩小原命令选择范围。"
    },
    {
      "id": "T01-V02",
      "command": "go test -race -count=5 ./claude -run TestAlignmentStdin",
      "cwd": "repository_root",
      "environment": {
        "AGENT_ADAPTOR_LIVE_CONFORMANCE": "0",
        "AGENT_ADAPTOR_E2E": "0",
        "AGENT_ADAPTOR_UPDATE_API_GOLDEN": "0"
      },
      "required": true,
      "execution_condition": "assigned_environment_available",
      "must_execute_nonzero_tests": true,
      "evidence": "记录实际命令、head SHA、OS/Go/CLI版本、exit code和安全日志；失败/skip/零测试不算通过。 非零按本命令实际测试/子测试计数，fuzz按实际种子/执行样本计数；必需场景skip不得通过。普通任务显式禁用的live探针或合同确认不适用的probe可skip，须列明且不能拿它们充当验收证据；可添加-json/-v采集日志，不能缩小原命令选择范围。"
    }
  ],
  "documentation": {
    "fragment": "docs/alignment-tasks/2026-09-07/handoffs/T01/documentation.md",
    "contents": [
      "公开语义前后变化和可复现例子",
      "应合并到的godoc/使用文档/CHANGELOG具体段落",
      "新增公共声明与golden理由",
      "不采用的internal行为和原因",
      "验证实跑/未跑的平台与live边界"
    ],
    "central_owner": "G01",
    "must_integrate_before_batch_acceptance": true
  },
  "handoff": {
    "result_path": "docs/alignment-tasks/2026-09-07/handoffs/T01/result.json",
    "schema_path": "docs/alignment-tasks/2026-09-07/result.schema.json",
    "evidence_dir": "docs/alignment-tasks/2026-09-07/handoffs/T01/evidence",
    "failure_report": "docs/alignment-tasks/2026-09-07/handoffs/T01/findings.md",
    "requirement_ids": [
      "W01-R01",
      "W01-R02",
      "W01-R03",
      "W01-R04"
    ],
    "commit_rule": "只提交本任务实施/局部godoc/测试与契约文件。源码commit完成并测试后生成result，记录实际head；result/evidence由派发器收集，不塞回所引用commit造成SHA自引用。"
  },
  "completion": {
    "required": [
      "所有必需acceptance/validation实际通过；verification任务不得以skip或零测试充数",
      "所有owned/verified requirement逐条记录passed/failed/blocked及证据",
      "工作树生产diff仅在allow范围；无TODO/未实现stub/旧API",
      "按handoff schema报告真实base/head/commit/changed_files/测试/文档与remaining_items",
      "本task通过只表示交付，不等于批次gate或整个work_item已关闭"
    ],
    "blocked_rule": "缺前置合同/runner/live授权时记录blocked与可执行缺项；发现合同违背或测试失败为needs_rework，向原owner提交最小复现，绝不声称完成或偷偷删工作项。"
  },
  "dispatch_prompt": "读取整个task.json和context.required_reads；确认基线和dependency_artifacts已由前批gate验收。只在隔离worktree按ownership实施implementation_steps，逐项满足acceptance_criteria、requirements_owned/verified与validation。严格遵守invariants，用handoff.result_path/schema交付真实结果；不要只根据标题工作，也不要提前执行本批gate或后批任务。"
}
